{
  "schemaVersion": 1,
  "repository": "mitsevox/nflstreet2",
  "target": {
    "id": "GN7E69",
    "console": "GameCube",
    "sha1": "3561e946e9ff785b68692f87d2ba85d81fd2dcf4"
  },
  "workflow": ".github/workflows/baseline.yml",
  "branch": "main",
  "artifact": "report-v1",
  "job": "Toolchain baseline",
  "requiredSteps": [
    "Verify publication handoff rules",
    "Decide required validation lanes",
    "Prepare report-v1 inputs",
    "Package and validate report-v1",
    "Upload report-v1 package"
  ],
  "tools": [
    {
      "name": "build-environment",
      "identity": "ghcr.io/mitsevox/nflstreet2-build@sha256:2b4967b77a5d74fb4575ec522ca0a60d8769605e7f5c9c162fb4e55959250aae"
    }
  ],
  "lanes": {
    "full": [
      "Verify review clearance logic",
      "Prepare pinned compiler stages",
      "Verify source build against complete target",
      "Verify provisional function inventory",
      "Verify compiler stages",
      "Verify inventory cache invalidation and real warm reuse",
      "Measure exact and fuzzy source comparisons",
      "Verify both progress exports, maps, history and contributor credits",
      "Verify activity and live receipts on the host"
    ],
    "reused": [
      "Publish authenticated final-integration reports"
    ]
  },
  "workflowBlobs": [
    "98a97409baceb8d8d9f9bf5706507b91331e8e4d",
    "f209bfa23df04f7da077f4ca93154da6fe8dddce"
  ]
}
