{
  "schemaVersion": 1,
  "repository": "OWNER/example-game",
  "target": {
    "id": "EXAMPLE",
    "console": "Console name",
    "sha1": "0000000000000000000000000000000000000000"
  },
  "workflow": ".github/workflows/build.yml",
  "branch": "main",
  "workflowBlobs": [
    "0000000000000000000000000000000000000000"
  ],
  "artifact": "public-report",
  "job": "Build and measure",
  "requiredSteps": [
    "Validate public report"
  ],
  "lanes": {
    "full": [
      "Build complete target",
      "Measure source"
    ],
    "reused": [
      "Authenticate complete source proof"
    ]
  },
  "tools": [
    {
      "name": "example-toolchain",
      "identity": "fixture-only"
    }
  ]
}
